{
  "$schema": "https://example.local/schemas/two-truths-and-a-lie.schema.json",
  "game": "two-truths-and-a-lie",
  "version": 1,
  "displayName": "Two Truths and a Lie",
  "roundsPerSession": 10,
  "sessions": [
    {
      "id": "ttl-session-01",
      "title": "Two Truths and a Lie Deck 1",
      "theme": "Bible figures and events",
      "rounds": [
        {
          "id": "ttl-r001-noah",
          "subject": "Noah",
          "subjectType": "person",
          "statements": [
            "Noah built the ark according to God's instructions.",
            "The ark had three stories.",
            "The ark had four stories."
          ],
          "lieIndex": 2,
          "explanation": "Genesis 6:16 describes the ark with lower, second, and third stories — three levels, not four.",
          "reference": "Genesis 6-9",
          "theme": "Genesis",
          "difficulty": "hard",
          "teachingNote": "Genesis 6:16 describes the ark with lower, second, and third stories — three levels, not four."
        },
        {
          "id": "ttl-r002-moses",
          "subject": "Moses",
          "subjectType": "person",
          "statements": [
            "Moses was found as a baby in a basket among the reeds.",
            "Moses led the Israelites out of Egypt through the Red Sea.",
            "Moses parted the Jordan River to lead Israel out of Egypt."
          ],
          "lieIndex": 2,
          "explanation": "Moses parted the Red Sea in Exodus 14. Joshua later led Israel across the Jordan River.",
          "reference": "Exodus 2, 14",
          "theme": "Exodus",
          "difficulty": "easy",
          "teachingNote": "Moses parted the Red Sea in Exodus 14. Joshua later led Israel across the Jordan River."
        },
        {
          "id": "ttl-r003-david-and-goliath",
          "subject": "David and Goliath",
          "subjectType": "event",
          "statements": [
            "David defeated Goliath with a sling and a stone.",
            "Goliath was a Philistine giant.",
            "David used King Saul's armor and sword to fight Goliath."
          ],
          "lieIndex": 2,
          "explanation": "David refused Saul's armor because it didn't fit and he wasn't used to it (1 Samuel 17:39).",
          "reference": "1 Samuel 17",
          "theme": "1 Samuel",
          "difficulty": "medium",
          "teachingNote": "David refused Saul's armor because it didn't fit and he wasn't used to it (1 Samuel 17:39)."
        },
        {
          "id": "ttl-r004-samson",
          "subject": "Samson",
          "subjectType": "person",
          "statements": [
            "Samson's strength was tied to his uncut hair.",
            "Delilah cut Samson's hair to weaken him.",
            "Samson was one of the twelve apostles."
          ],
          "lieIndex": 2,
          "explanation": "Samson was a judge of Israel, long before the New Testament apostles.",
          "reference": "Judges 13-16",
          "theme": "Judges",
          "difficulty": "hard",
          "teachingNote": "Samson was a judge of Israel, long before the New Testament apostles."
        },
        {
          "id": "ttl-r005-daniel",
          "subject": "Daniel",
          "subjectType": "person",
          "statements": [
            "Daniel was thrown into a lions' den for praying.",
            "Daniel interpreted the king's dreams.",
            "Daniel was killed by the lions."
          ],
          "lieIndex": 2,
          "explanation": "God shut the lions' mouths and Daniel was unharmed (Daniel 6:22).",
          "reference": "Daniel 6",
          "theme": "Daniel",
          "difficulty": "medium",
          "teachingNote": "God shut the lions' mouths and Daniel was unharmed (Daniel 6:22)."
        },
        {
          "id": "ttl-r006-jonah",
          "subject": "Jonah",
          "subjectType": "person",
          "statements": [
            "Jonah was swallowed by a great fish.",
            "Jonah was sent to preach to Nineveh.",
            "Jonah eagerly obeyed God's call from the start."
          ],
          "lieIndex": 2,
          "explanation": "Jonah initially fled from God's call and boarded a ship to Tarshish instead (Jonah 1:3).",
          "reference": "Jonah 1-3",
          "theme": "Jonah",
          "difficulty": "easy",
          "teachingNote": "Jonah initially fled from God's call and boarded a ship to Tarshish instead (Jonah 1:3)."
        },
        {
          "id": "ttl-r007-esther",
          "subject": "Esther",
          "subjectType": "person",
          "statements": [
            "Esther became queen of Persia.",
            "Esther risked her life to save the Jewish people.",
            "Esther's story is set during the Babylonian exile under Nebuchadnezzar."
          ],
          "lieIndex": 2,
          "explanation": "Esther's story takes place in Persia under King Ahasuerus, not Babylon under Nebuchadnezzar.",
          "reference": "Esther 2, 4",
          "theme": "Esther",
          "difficulty": "hard",
          "teachingNote": "Esther's story takes place in Persia under King Ahasuerus, not Babylon under Nebuchadnezzar."
        },
        {
          "id": "ttl-r008-ruth",
          "subject": "Ruth",
          "subjectType": "person",
          "statements": [
            "Ruth was a Moabite who stayed loyal to her mother-in-law Naomi.",
            "Ruth gleaned grain in the fields of Boaz.",
            "Ruth was the mother of King David."
          ],
          "lieIndex": 2,
          "explanation": "Ruth was David's great-grandmother — her son Obed was the father of Jesse, David's father.",
          "reference": "Ruth 1, 2, 4",
          "theme": "Ruth",
          "difficulty": "easy",
          "teachingNote": "Ruth was David's great-grandmother — her son Obed was the father of Jesse, David's father."
        },
        {
          "id": "ttl-r009-joseph-son-of-jacob",
          "subject": "Joseph son of Jacob",
          "subjectType": "person",
          "statements": [
            "Joseph's brothers sold him into slavery.",
            "Joseph became a powerful official in Egypt.",
            "Joseph was the firstborn son of Jacob."
          ],
          "lieIndex": 2,
          "explanation": "Reuben was Jacob's firstborn; Joseph was the eleventh of twelve sons.",
          "reference": "Genesis 37",
          "theme": "Genesis",
          "difficulty": "medium",
          "teachingNote": "Reuben was Jacob's firstborn; Joseph was the eleventh of twelve sons."
        },
        {
          "id": "ttl-r010-abraham",
          "subject": "Abraham",
          "subjectType": "person",
          "statements": [
            "God changed Abram's name to Abraham.",
            "Abraham was asked to sacrifice his son Isaac.",
            "Abraham was the father of the twelve tribes of Israel."
          ],
          "lieIndex": 2,
          "explanation": "Abraham's grandson Jacob had twelve sons who became the twelve tribes.",
          "reference": "Genesis 17, 22",
          "theme": "Genesis",
          "difficulty": "hard",
          "teachingNote": "Abraham's grandson Jacob had twelve sons who became the twelve tribes."
        }
      ]
    },
    {
      "id": "ttl-session-02",
      "title": "Two Truths and a Lie Deck 2",
      "theme": "Bible figures and events",
      "rounds": [
        {
          "id": "ttl-r011-jacob",
          "subject": "Jacob",
          "subjectType": "person",
          "statements": [
            "Jacob wrestled with an angel and was renamed Israel.",
            "Jacob had twelve sons.",
            "Jacob was Isaac's older twin brother."
          ],
          "lieIndex": 2,
          "explanation": "Esau was born first; Jacob was Isaac's younger twin son.",
          "reference": "Genesis 25, 32",
          "theme": "Genesis",
          "difficulty": "medium",
          "teachingNote": "Esau was born first; Jacob was Isaac's younger twin son."
        },
        {
          "id": "ttl-r012-elijah",
          "subject": "Elijah",
          "subjectType": "person",
          "statements": [
            "Elijah defeated the prophets of Baal on Mount Carmel.",
            "Elijah was taken up to heaven in a whirlwind.",
            "Elijah never experienced discouragement or fear."
          ],
          "lieIndex": 2,
          "explanation": "Elijah fled in fear from Jezebel and asked God to let him die (1 Kings 19).",
          "reference": "1 Kings 18-19",
          "theme": "1 Kings",
          "difficulty": "easy",
          "teachingNote": "Elijah fled in fear from Jezebel and asked God to let him die (1 Kings 19)."
        },
        {
          "id": "ttl-r013-solomon",
          "subject": "Solomon",
          "subjectType": "person",
          "statements": [
            "Solomon asked God for wisdom.",
            "Solomon built the first temple in Jerusalem.",
            "Solomon was the first king of Israel."
          ],
          "lieIndex": 2,
          "explanation": "Saul was Israel's first king; Solomon was the third, after Saul and his father David.",
          "reference": "1 Kings 3, 6",
          "theme": "1 Kings",
          "difficulty": "hard",
          "teachingNote": "Saul was Israel's first king; Solomon was the third, after Saul and his father David."
        },
        {
          "id": "ttl-r014-job",
          "subject": "Job",
          "subjectType": "person",
          "statements": [
            "Job lost his wealth, health, and children in a series of trials.",
            "In the end, God restored Job's fortunes.",
            "Job cursed God and rejected his faith by the end of the story."
          ],
          "lieIndex": 2,
          "explanation": "Job never cursed God — he struggled and questioned, but remained faithful (Job 1:22).",
          "reference": "Job 1-2, 42",
          "theme": "Job",
          "difficulty": "easy",